DatabaseColumnName,Description,CategoricalValues
AppliancesDetails,A list of the appliances that will be included in the sale/lease of the property.,"convection oven, warmer oven drawer, range hood, exhaust fan, dryer, water heater, water heater central, water purifier, energy star qualified appliances, continuous clean oven, coal water heater, instant hot water, gas, propane range, gas stove, propane cooktop, range, electric water heater, oven-electric, electric cooktop, propane water heater, electric, wtr softener/owned, built-in bbq, gas oven, gas cooking, portable dishwasher, hot water circulator, self cleaning oven, free standing gas, built-in range, oven-gas, built-in gas, freezer, disposal, microwave, free-standing range, built-in electric oven, free standing electric, gas & electric range, gas/elec dryer hookup, cooktop - gas, indoor grill, electric range, electric oven, recirculated exhaust fan, 6 burner stove, high efficiency water heater, gas range, gas/electric range, washer, free-standing refrigerator, dishwasher, ice maker, water line to refrigerator, plumbed for ice maker, refrigerator, built-in and free standing, no hot water, warming drawer, tankless water heater, energy star qualified water heater, gas grill, oven, built-in, built-in electric, water softener, gas water heater, built-ins, propane oven, gas cooktop, gas dryer hookup, double oven, solar hot water, barbecue, cooktop - electric, trash compactor, vented exhaust fan"
InteriorDetails,A list of features or description of the interior of the property.,"high ceilings (9 feet+), master retreat, trash chute, kitchen, formal entry, laundry - closet stacked, living room balcony, wired for sound, detached/no common walls, built-in features, dining room, wainscoting, storage, two story ceilings, laminate counters, living room deck attached, trey ceiling(s), family room, quartz counters, sump pump, cathedral ceiling(s), common walls, pre-wired for high speed data, copper plumbing full, recessed lighting, corian counters, track lighting, vaulted ceiling(s), stair climber, wainscotting, chair railings, block walls, ceramic counters, electronic air cleaner, bidet, phone system, wired for data, crown moldings, storage space, tandem, mirrored closet door(s), open floor plan, turnkey, furnished, drywall walls, dry bar, pantry, beamed ceiling(s), crown molding, sunken living room, vacuum central, main floor bedroom, walk in closet, ceiling fan(s), high ceilings, wet bar, cathedral-vaulted ceilings, beamed ceilings, office, bar, intercom, unfinished walls, main floor master bedroom, granite counters, wood product walls, tile counters, suspended ceiling(s), coffered ceiling(s), attic fan, in-law floorplan, pull down stairs to attic, tray ceiling(s), open floorplan, 2 staircases, formica counters, living room, stone counters, primary bathroom, pre-wired for surround sound, built-ins, partially furnished, elevator, copper plumbing partial, primary bedroom 2+, brick walls, all bedrooms up, home automation system, balcony, dumbwaiter, unfurnished, hot tub, master suite"
ExteriorDetails,A list of features or description of the exterior of the property.,"unit faces common area, yard space, koi pond, corral, stucco, dock private, dog run, side yard, landscape back, lighting, landscape front, sprinklers front, boat slip, sprinklers back, tv antenna, lawn, storage, pier, sprinklers automatic, rain gutters, satellite dish, kennel, awning(s), sump pump, boat lift, pool, see remarks, backyard, front yard, barbecue private, patio open, fruit trees, patio covered, yard irrigation t/o, stable, stone, back yard, balcony, unit faces street, spa-outside"
FencingDetails,A list of types of fencing found at the property being sold.,"full, wood, brick wall, chain link, poor condition, electric, brick, block, fenced, invisible, redwood, masonry, wrought iron, stucco wall, security, livestock, gate, good condition, glass/plexiglass, wire, see remarks, barbed wire, vinyl, blockwall, fenced back, partial, grapestake, pipe, fair condition, new condition, cross fenced, excellent condition, split rail, stone, back yard, privacy, needs repair, glass, average condition"
PetsAllowedYN,"A True/False flag indicates if pets are allowed in the property, usually as part of a lease condition or HOA rule. A list of yes, no and more detailed restrictions/allowances.",
HorseZoningYN,A True/False flag indicating if the property is zoned for raising horses.,
SeniorCommunityYN,A True/False flag indicating if the property is located in a senior community.,
WaterfrontYN,A True/False flag indicating if the property is on the waterfront.,
WaterfrontDetails,A list of features of the waterfront on which the property is located.,"pond, seawall, navigable water, lake, ocean access, lake privileges, beach front, ocean side of highway 1, bay front, includes dock, canal front, ocean side of freeway, reservoir in community, river front, fishing in community, lagoon, across the road from lake/ocean, sea front, beach access, beach rights, waterfront with home across road, creek, ocean, stream, marina, lake front, ocean front, marina in community"
SchoolElementary,The name of the elementary school having a catchment area that includes the associated property.,
SchoolElementaryDistrict,The name of the elementary school district having a catchment area that includes the associated property.,
SchoolMiddle,The name of the junior or middle school having a catchment area that includes the associated property.,
SchoolMiddleDistrict,The name of the junior or middle school district having a catchment area that includes the associated property. ,
SchoolHigh,The name of the high school having a catchment area that includes the associated property.,
SchoolHighDistrict,"The name of the high school district having a catchment area that includes the associated property.  When only one school district is used, this field should be used over the Junior or Elementary Districts.",
LandLeaseYN,A True/False flag indicating if the land is not included in the sale and a lease exists.,
LandLeaseAmount,"When the land is not included in the sale, but is leased, the amount of the lease.  This is the Space Rent for Mobile homes in a Park.",
LandLeaseAmountFrequency,"When the land is not included in the sale, but is leased, the frequency the Land Lease Fee is paid.",
RentControlYN,A True/False flag indicating if the property is in a rent controlled area.,
PhotosCount,The total number of pictures or photos included with the listing. We include all available photos.,
PhotoKey,Unique ID for every listing to identify the photos.,
PhotoURLPrefix,Prefix for constructing photo URL.,
PetsDetails,A list of features indicating which pets are allowed.,"call, number limit, breed restrictions, dogs ok, weight limit, call for rules, yes, cats ok, assoc pet rules, pets permitted, no, size limit, submit pets, permitted types"
